{
  "ID": 1,
  "site_ID": 1,
  "author": {
  },
  "date": "some string",
  "modified": "some string",
  "title": "some string",
  "URL": "some string",
  "short_URL": "some string",
  "content": "some string",
  "excerpt": "some string",
  "slug": "some string",
  "guid": "some string",
  "status": "some string",
  "password": "some string",
  "parent": false,
  "type": "some string",
  "comments_open": false,
  "pings_open": false,
  "comment_count": 1,
  "like_count": 1,
  "i_like": false,
  "is_reblogged": false,
  "is_following": false,
  "global_ID": "some string",
  "featured_image": "some string",
  "format": "some string",
  "geo": false,
  "publicize_URLs": [
  ],
  "tags": {
  },
  "categories": {
  },
  "attachments": {
  },
  "metadata": [
  ],
  "meta": {
  }
}